{
  "$schema": "https://json-schema.org/draft/2020-12/schema",
  "title": "codis-agents project configuration (.claude/codis-agents.json)",
  "type": "object",
  "additionalProperties": false,
  "required": ["repoDir", "worktreeRoot", "sharedDir"],
  "properties": {
    "$schema": { "type": "string" },
    "repoDir": { "type": "string", "description": "Main checkout of the project; worktrees are created from it. ~ is expanded." },
    "worktreeRoot": { "type": "string", "description": "Directory that holds one worktree per task; a worktree name is resolved against it." },
    "sharedDir": { "type": "string", "description": "Task folders live here: <sharedDir>/<task>/{BRIEF,analyst,prog,test,review}.md. Guard logs go here too." },
    "guardCommand": { "type": "string", "description": "Full guard run, executed with zsh in the worktree. Placeholders: {wt} worktree directory (required), {jobs} (optional) worker count from the slot budget, {limitFile} (optional) file the runner re-reads for an adaptive worker limit. Without {jobs} and {limitFile} the runner sets its own workers: guards-all.sh counts it as the whole budget (slots.jobsAlone) and starts it only when that whole budget is free." },
    "guardCommandLegacy": { "type": "string", "description": "Guard command for worktrees whose runner has no adaptive limit (no {limitFile}). Used when guardAdaptiveProbe fails." },
    "guardAdaptiveProbe": {
      "type": "object", "additionalProperties": false, "required": ["file", "contains"],
      "properties": { "file": { "type": "string", "description": "Path relative to the worktree." }, "contains": { "type": "string" } },
      "description": "When set, guardCommand is used only if <wt>/<file> contains <contains>; otherwise guardCommandLegacy."
    },
    "guardExclusive": {
      "type": "object", "additionalProperties": false, "required": ["glob", "marker"],
      "description": "Which guards share a machine resource (a fixed port, a temp dir, a docker project) and run one at a time under the exclusive lock (heavy.sh): a command argument that is a file whose name matches one of glob and that has a line <marker> guards:exclusive — <reason>. Without the key: glob [*-run.js, *-run.mjs], marker //.",
      "properties": {
        "glob": { "type": "array", "minItems": 1, "items": { "type": "string", "minLength": 1, "pattern": "^[^/]+$" }, "description": "zsh patterns of the file name (no /, and each must compile as a zsh pattern under extendedglob - config.js check refuses one that does not), e.g. [\"test_*.py\", \"*_test.py\"]." },
        "marker": { "type": "string", "minLength": 1, "pattern": "^\\S+$", "description": "The line-comment marker of the language, taken literally, e.g. # or //." }
      }
    },
    "guardRerun": {
      "type": "object", "additionalProperties": false, "required": ["command", "newRedPattern"],
      "properties": {
        "command": { "type": "string", "description": "Runs ONE guard, with zsh in the worktree; placeholders {wt} and {name} (both shell-quoted). Exit 0 - green alone." },
        "newRedPattern": { "type": "string", "description": "Regular expression applied to every line of the full-run log (multiline); capture group 1 is the name of a NEW red guard, as {name} takes it." },
        "tallyPattern": { "type": "string", "description": "Regular expression of the runner's final tally line. When set and absent from the log (a run cut off before its tally), nothing reruns and the runner's exit code stands." },
        "maxReruns": { "type": "integer", "minimum": 1, "default": 10, "description": "More new reds than this: nothing reruns (a mass red is not flakiness), the runner's exit code stands." }
      },
      "description": "After a red full run guards-all.sh reruns each new red alone in the same slot: red again - a new red (the runner's exit code stays); green alone - flaky (listed for the project backlog, not a regression). Only flaky -> exit 0. Without this key nothing reruns."
    },
    "guardBaseline": { "type": "string", "pattern": "^[^/~]", "description": "Known reds of the project: path, relative to the worktree, of a JSON file {\"<guard name>\": \"<reason>\"} committed with the project. After a red full run guards-all.sh subtracts the names found there before maxReruns is counted and never reruns them: only known reds -> exit 0 and \"N known red\"; a known name not red in a finished run is named for removal; a missing or broken file is an error line and the runner's exit code stands. Needs guardRerun (the names come from its newRedPattern)." },
    "guardFiles": { "type": "array", "items": { "type": "string" }, "minItems": 1, "default": ["*-run.js", "*-run.mjs", "*-run.cjs"], "description": "Globs of the project's guard files (scripts/guards-select.js). A glob without / matches the file name at any depth; with / the path from the repository root; * and ? stay within one segment, ** crosses them." },
    "guardAlways": { "type": "array", "items": { "type": "string" }, "description": "Guards always in the selection (a guard whose repository path contains an entry), such as scanners of the diff: secrets, semgrep." },
    "guardSubsetCommand": { "type": "string", "description": "Runs the selected guards, with zsh; placeholders {wt} (worktree) and {onlyArgs} (--only <guard> per selected guard, shell-quoted). Contract: it narrows guardCommand to the selected guards of the same suite, so the full run includes every guard it selects. When set, the workflow runs one full run (guardCommand) after the programmer's last commit, which covers the selection: the programmer runs only its new guards and mutations, the tester the selection after its own commits; without it the programmer runs the full run itself as before." },
    "worktreeSetup": {
      "type": "object", "additionalProperties": false,
      "properties": {
        "scan": { "type": "array", "items": { "type": "string" }, "description": "Directories whose git-ignored contents are copied into a new worktree." },
        "skip": { "type": "array", "items": { "type": "string" }, "description": "Globs of ignored paths that are not copied." },
        "link": { "type": "array", "items": { "type": "string" }, "description": "Globs of ignored paths that are symlinked instead of cloned. Everything else is an APFS clone (cp -c), never a link." }
      }
    },
    "slots": {
      "type": "object", "additionalProperties": false,
      "properties": {
        "medium": { "type": "integer", "minimum": 1, "description": "Medium slots (tsc, one bundler build without a browser)." },
        "heavy": { "type": "integer", "minimum": 1, "description": "Heavy slots (browser guards, full guard runs, image builds). One more is admitted only while free memory holds and swap does not grow." },
        "total": { "type": "integer", "minimum": 1, "description": "Ceiling for medium + heavy slots together." },
        "lockDir": { "type": "string", "description": "Directory for slot lock files and the waiting queue." },
        "legacyLock": { "type": "string", "description": "Optional single lock file of an older setup; while held it counts as one heavy slot." },
        "jobsAlone": { "type": "integer", "minimum": 1, "description": "Guard workers of all full runs together; a lone full run gets all of them." },
        "jobsShared": { "type": "integer", "minimum": 1, "description": "Worker cap for a full run while another heavy slot is busy." }
      }
    },
    "reportLanguage": { "type": "string", "description": "Language of role reports (prompts stay in English)." },
    "defaultBranch": { "type": "string", "description": "The default branch: the base of new worktrees and, without protectedBranches, the protected one. Leave it out to take it from git (where refs/remotes/origin/HEAD points); set it when the remote is not origin." },
    "protectedBranches": { "type": "array", "items": { "type": "string" }, "description": "Branches nobody pushes to without ALLOW_PROTECTED_PUSH=1. Default: [defaultBranch]; when the default branch is unknown, the hooks refuse every branch push." },
    "protectedTagPattern": { "type": "string", "description": "Regular expression for tag names that must not be pushed without ALLOW_PROTECTED_PUSH=1 (e.g. release tags that deploy)." },
    "ownerStackReadOnly": { "type": "string", "description": "Docker Compose project of the owner: roles may only read from it." },
    "medianTaskIE": { "type": "number", "description": "Median input-equivalent tokens of an accepted task; chain-cost flags tasks above twice this." },
    "featureIELimit": { "type": "number", "exclusiveMinimum": 0, "description": "Cost of a whole feature (its parts summed by the task field feature) above which chain-cost flags it; default 3 x medianTaskIE." },
    "testerWritable": { "type": "array", "items": { "type": "string" }, "description": "Regular expressions of paths the tester may change (the project's guards and their fixtures). No default: without it the role chain stops every task before any agent." },
    "roleNotes": {
      "type": "object", "additionalProperties": false,
      "properties": {
        "analyst": { "type": "string" }, "programmer": { "type": "string" }, "tester": { "type": "string" },
        "reviewer": { "type": "string" }, "security-reviewer": { "type": "string" }
      },
      "description": "Project-specific lines appended to one role's prompt."
    },
    "roleModel": { "type": "string", "enum": ["sonnet", "opus", "haiku", "fable"], "description": "Model alias of every role agent of the chain (opts.model of the Workflow agent()). Leave it out to let the roles inherit the main session's model. The first attempt of a post-check or wait step stays on haiku." },
    "roleModels": {
      "type": "object", "additionalProperties": false,
      "properties": {
        "analyst": { "enum": ["sonnet", "opus", "haiku", "fable"] }, "programmer": { "enum": ["sonnet", "opus", "haiku", "fable"] }, "tester": { "enum": ["sonnet", "opus", "haiku", "fable"] },
        "reviewer": { "enum": ["sonnet", "opus", "haiku", "fable"] }, "security-reviewer": { "enum": ["sonnet", "opus", "haiku", "fable"] }, "preconditions": { "enum": ["sonnet", "opus", "haiku", "fable"] },
        "wait": { "enum": ["sonnet", "opus", "haiku", "fable"] }
      },
      "description": "Model alias per role, over roleModel: the roles, the preconditions agent, and wait - the repeat of a post-check or wait step."
    },
    "threatModel": { "type": "string", "description": "Path (relative to the worktree) of the threat model the security reviewer reads." },
    "gitHooks": {
      "type": "object", "additionalProperties": false,
      "properties": {
        "blockICloudCopies": { "type": "boolean", "description": "pre-commit refuses files named like iCloud conflict copies (\"name 2.ext\")." },
        "preCommit": { "type": "array", "items": { "type": "string" }, "description": "Extra shell commands run by pre-commit in the repository root; a non-zero exit refuses the commit." }
      }
    },
    "preconditions": {
      "type": "object", "additionalProperties": false,
      "properties": {
        "minFreeDiskGB": { "type": "number", "minimum": 0, "description": "Free disk (GB) the preconditions require on the volumes of the worktree and the task folder (default 10)." },
        "minSwapGB": { "type": "number", "minimum": 0, "description": "Swap headroom (GB) the preconditions require: on macOS the free part of the swap files plus the free space of the VM volume, on Linux SwapFree (default 4: four slots of ~1 GB)." }
      },
      "description": "Machine settings, read from the machine file (minFreeDiskGB, swapMinMB): a project may still carry them until config.js migrate - equal to the machine file a warning, different an error; minSwapGB is compared as x 1024 with swapMinMB."
    },
    "stand": {
      "type": "object", "additionalProperties": false, "required": ["project", "up", "deploy", "reset", "status", "down"],
      "properties": {
        "project": { "type": "string", "pattern": "^[a-z0-9][a-z0-9_-]*$", "description": "Docker Compose project of the shared stand; never the owner's stack (ownerStackReadOnly)." },
        "ports": { "type": "array", "items": { "type": "integer", "minimum": 1, "maximum": 65535 }, "description": "Ports of the stand on the host; {port} is the first, {ports} all of them." },
        "up": { "type": "string", "description": "Brings the stand up (the coordinator: stand.sh up). Placeholders {project}, {port}, {ports}, {repo}." },
        "deploy": { "type": "string", "description": "Deploys the committed HEAD of a worktree into the stand; must contain {wt}. Run by stand.sh deploy for the ticket holder only, in a medium slot." },
        "reset": { "type": "string", "description": "Makes the stand as new (sessions, builds, storage, task settings); run by stand.sh before a ticket is given and at release, while the ticket is held." },
        "status": { "type": "string", "description": "Exits 0 only while the stand is up and ready; its output is shown by stand.sh status. take refuses while it fails." },
        "down": { "type": "string", "description": "Takes the stand down (the coordinator: stand.sh down; refused while the ticket is held, unless --force)." },
        "imageFiles": { "type": "array", "items": { "type": "string" }, "description": "Globs of the files that define the stand's image (Dockerfile, package manifests, compose files, .dockerignore). A task whose commits touch one builds its own stack instead (stand.sh image-diff). A glob without / matches the file name at any depth; * and ? stay within a path segment, ** crosses them." },
        "memLimitMB": { "type": "number", "exclusiveMinimum": 0, "description": "Memory ceiling of the whole stand in MB (for reference; shown by stand.sh status)." },
        "cwd": { "type": "string", "description": "Directory the stand's commands run in (zsh, cwd): an absolute path or one starting with ~, an existing directory (config.js check). Without it: repoDir. Lets the commands use paths relative to a checkout other than repoDir, so the config of a branch and of the main checkout can be the same." }
      },
      "description": "The project's shared stand: one Docker stack that tasks take in turn by ticket (scripts/stand.sh) instead of building their own. The plugin only calls these commands, with zsh in stand.cwd (repoDir without it); what they do is the project's."
    },
    "remoteRun": {
      "type": "object", "additionalProperties": false,
      "properties": {
        "command": { "type": "string", "description": "The guard command on the runner (default guardCommand); placeholders as guardCommand, must contain {wt}. E.g. guardCommand plus a runner flag that skips the guards the runner cannot run." },
        "commandLegacy": { "type": "string", "description": "The command on the runner for worktrees where guardAdaptiveProbe fails (default guardCommandLegacy)." },
        "deps": {
          "type": "array",
          "items": {
            "type": "object", "additionalProperties": false, "required": ["files", "install", "link"],
            "properties": {
              "files": { "type": "array", "minItems": 1, "items": { "type": "string", "pattern": "^(?![/~])(?!.*(^|/)\\.{1,2}(/|$))[^'\\n\\\\]+$" }, "description": "Files relative to the worktree (distinct base names) copied into the cache directory: the package manifest and its lock file." },
              "install": { "type": "string", "minLength": 1, "description": "Runs in the cache directory once per hash, in a medium slot of the runner (zsh), e.g. npm ci." },
              "link": { "type": "object", "minProperties": 1, "additionalProperties": { "type": "string" }, "description": "{\"<path in the worktree>\": \"<path inside the cache directory, empty for the directory itself>\"}, relative paths without ..; each link leads to its real path in one step." }
            }
          },
          "description": "Dependencies installed on the runner into a cache shared by runs: one directory <root>/deps/<hash> per hash of the files' base names and contents, the install command, the node major version, platform and arch."
        },
        "prepare": { "type": "array", "items": { "type": "string" }, "description": "Commands run in the runner's worktree before the run, in a medium slot (zsh), e.g. a browser install." },
        "localPattern": { "type": "string", "description": "Regular expression over the lines of the runner's log; capture group 1 is a ', '-separated list of guards the runner did not run. They run on this machine after it, in a heavy slot, by localCommand, as a section of the same log; the worse exit code is the run's." },
        "localCommand": { "type": "string", "description": "Runs those guards on this machine (zsh; {wt}, {onlyArgs} = --only <guard> per guard, shell-quoted); default guardSubsetCommand." }
      },
      "description": "The full guard run on the remote runner of the machine file (scripts/guards-remote.js through guards-all.sh): what the runner needs that this machine has by other means. Left out: the runs stay on this machine even when the machine file names a runner."
    },
    "standingPush": {
      "type": "object", "additionalProperties": false, "required": ["branches", "check"],
      "properties": {
        "branches": { "type": "array", "minItems": 1, "items": { "type": "string" }, "description": "Branches this repository's HEAD may be pushed to without ALLOW_PROTECTED_PUSH=1." },
        "check": { "type": "string", "minLength": 1, "description": "Shell command run in the repository root before the push (e.g. the test for secrets and personal paths); a non-zero exit refuses the push." }
      },
      "description": "Standing permission to push - only for the repository of process rules (the plugin itself), whose owner granted it; never in a product repository. Honoured only from the committed config of the repository that pushes (not the session's project, not an uncommitted edit), only for the checked-out HEAD with unmodified tracked files, never forced or deleting; tags are never covered."
    }
  }
}
